{
  "id": "prov_imereti",
  "name": {
    "display": "Iméréthie (Koutaïssi)",
    "local": "იმერეთი",
    "local_language": "géorgien"
  },
  "region": "caucase",
  "terrain": "hills",
  "climate": "oceanic",
  "neighbors": [],
  "coastal": false,
  "rivers": [
    "Rioni"
  ],
  "resources": [
    "res_wine",
    "res_wood",
    "res_wheat"
  ],
  "capital_city": {
    "name": {
      "display": "Koutaïssi",
      "local": "ქუთაისი",
      "local_language": "géorgien"
    },
    "lat": 42.27,
    "lon": 42.7
  },
  "geo": {
    "capital_lonlat": [
      42.7,
      42.27
    ],
    "seed_lonlat": [
      42.8,
      42.2
    ],
    "voronoi_weight": 1.0
  },
  "owner": "fac_georgia",
  "culture": "cul_georgian",
  "religion": "rel_orthodox",
  "population": {
    "classes": {
      "peasants": {
        "count": 44000,
        "unrest": 10,
        "health": 50,
        "wealth": 45,
        "goods_satisfaction": 60
      },
      "burghers": {
        "count": 5300,
        "unrest": 10,
        "health": 50,
        "wealth": 55,
        "goods_satisfaction": 60
      },
      "clergy": {
        "count": 1300,
        "unrest": 5,
        "health": 55,
        "wealth": 60,
        "goods_satisfaction": 70
      },
      "nobility": {
        "count": 530,
        "unrest": 10,
        "health": 60,
        "wealth": 70,
        "goods_satisfaction": 75
      }
    },
    "uncertain": true,
    "note": "Estimation de jeu (aucun recensement du XIVe siècle)."
  },
  "buildings": [
    "bld_market",
    "bld_castle",
    "bld_muster_field"
  ],
  "fortification_level": 3,
  "base_supply": 1100,
  "description": "Pays des rois d’Occident de Géorgie, autour de Koutaïssi et du monastère de Ghélati.",
  "sources": [
    "Imereti",
    "Kutaisi",
    "Gelati Monastery"
  ]
}
