{
  "id": "prov_svealand",
  "name": {
    "display": "Svealand et Uppland",
    "local": "Svealand",
    "local_language": "vieux suédois"
  },
  "region": "scandinavie",
  "terrain": "plains",
  "climate": "continental",
  "neighbors": [
    "prov_gotaland",
    "prov_vestlandet"
  ],
  "rivers": [
    "Fyris",
    "Svartån"
  ],
  "coastal": true,
  "ports": [
    "Stockholm",
    "Nyköping",
    "Selånger"
  ],
  "sea_zones": [
    "sea_baltic",
    "sea_gulf_of_bothnia"
  ],
  "resources": [
    "res_wheat",
    "res_wood",
    "res_iron",
    "res_stone",
    "res_fish"
  ],
  "capital_city": {
    "name": {
      "display": "Selånger",
      "local": "Selånger",
      "local_language": "vieux suédois"
    },
    "lat": 62.3958,
    "lon": 17.2843
  },
  "geo": {
    "capital_lonlat": [
      17.2843,
      62.3958
    ],
    "seed_lonlat": [
      17.6,
      59.75
    ],
    "voronoi_weight": 2.3
  },
  "owner": "fac_sweden",
  "culture": "cul_swedish",
  "religion": "rel_catholic",
  "population": {
    "classes": {
      "peasants": {
        "count": 260000,
        "unrest": 10,
        "health": 55,
        "wealth": 45,
        "goods_satisfaction": 60
      },
      "burghers": {
        "count": 16400,
        "unrest": 10,
        "health": 55,
        "wealth": 60,
        "goods_satisfaction": 65
      },
      "clergy": {
        "count": 7800,
        "unrest": 10,
        "health": 55,
        "wealth": 70,
        "goods_satisfaction": 75
      },
      "nobility": {
        "count": 3120,
        "unrest": 10,
        "health": 55,
        "wealth": 70,
        "goods_satisfaction": 75
      }
    },
    "uncertain": true,
    "note": "Estimation démographique approximative (aucun recensement en 1337)."
  },
  "buildings": [
    "bld_market",
    "bld_port",
    "bld_muster_field",
    "bld_cathedral"
  ],
  "fortification_level": 1,
  "base_supply": 2200,
  "description": "Cœur ancien du royaume autour du lac Mälar : Uppsala, siège de l’archevêque, Sigtuna, Stockholm (« Stockholm » citée depuis 1252) et les pierres de Mora, où l’on élit les rois. Province composée : regroupe aussi Bergslagen et Närke, Norrland.",
  "sources": [
    "Svealand",
    "Uppsala",
    "Stockholm",
    "Uppland",
    "Bergslagen",
    "Örebro",
    "Falun",
    "Norrland",
    "Selånger",
    "Hälsingland"
  ]
}
