{
  "id": "prov_beaucaire",
  "name": {
    "display": "Nîmois et Vivarais",
    "local": "Nemze",
    "local_language": "occitan"
  },
  "region": "languedoc",
  "terrain": "hills",
  "climate": "mediterranean",
  "neighbors": [],
  "rivers": [
    "Rhône",
    "Gard",
    "Ardèche",
    "Loire",
    "Saône",
    "Lez",
    "Hérault"
  ],
  "coastal": true,
  "ports": [
    "Aigues-Mortes",
    "Lattes"
  ],
  "sea_zones": [
    "sea_mediterranean"
  ],
  "resources": [
    "res_salt",
    "res_wine",
    "res_wool",
    "res_wheat",
    "res_cloth"
  ],
  "capital_city": {
    "name": {
      "display": "Lyon",
      "local": "Lion",
      "local_language": "franco-provençal"
    },
    "lat": 45.764,
    "lon": 4.8357
  },
  "geo": {
    "capital_lonlat": [
      4.8357,
      45.764
    ],
    "seed_lonlat": [
      4.0,
      44.3
    ],
    "voronoi_weight": 1.3
  },
  "owner": "fac_france",
  "culture": "cul_occitan",
  "religion": "rel_catholic",
  "population": {
    "uncertain": true,
    "note": "Nîmes compte environ 12 000 habitants.",
    "classes": {
      "peasants": {
        "count": 626881,
        "unrest": 10,
        "health": 55,
        "wealth": 45,
        "goods_satisfaction": 60
      },
      "burghers": {
        "count": 126600,
        "unrest": 10,
        "health": 49,
        "wealth": 62,
        "goods_satisfaction": 65
      },
      "clergy": {
        "count": 19500,
        "unrest": 5,
        "health": 60,
        "wealth": 70,
        "goods_satisfaction": 75
      },
      "nobility": {
        "count": 7019,
        "unrest": 10,
        "health": 60,
        "wealth": 70,
        "goods_satisfaction": 75
      }
    }
  },
  "buildings": [
    "bld_market",
    "bld_water_mill",
    "bld_port",
    "bld_vineyard_press",
    "bld_cathedral",
    "bld_stone_walls",
    "bld_muster_field"
  ],
  "fortification_level": 2,
  "base_supply": 12000,
  "description": "Sénéchaussée de Beaucaire-Nîmes, Vivarais, Gévaudan et Velay : rive droite du Rhône. Aigues-Mortes, port royal sur la Méditerranée ; salins de Peccais. Province composée : regroupe aussi Lyonnais et Forez, Seigneurie de Montpellier.",
  "sources": [
    "Sénéchaussée de Beaucaire",
    "Nîmes",
    "Aigues-Mortes",
    "Lyonnais",
    "Comté de Forez",
    "Lyon",
    "Seigneurie de Montpellier",
    "Royaume de Majorque",
    "Montpellier"
  ]
}
