{
  "id": "prov_liege",
  "name": {
    "display": "Liège",
    "local": "Liège",
    "local_language": "ancien français"
  },
  "region": "pays_bas",
  "terrain": "hills",
  "climate": "oceanic",
  "neighbors": [
    "prov_brabant",
    "prov_cologne",
    "prov_hainaut",
    "prov_ile_de_france",
    "prov_julich",
    "prov_lorraine",
    "prov_namur",
    "prov_trier"
  ],
  "rivers": [
    "Meuse",
    "Ourthe",
    "Sambre",
    "Moselle",
    "Sûre",
    "Alzette"
  ],
  "coastal": false,
  "resources": [
    "res_iron",
    "res_wheat",
    "res_cloth",
    "res_wood"
  ],
  "capital_city": {
    "name": {
      "display": "Liège",
      "local": "Liège",
      "local_language": "ancien français"
    },
    "lat": 50.6326,
    "lon": 5.5797
  },
  "geo": {
    "capital_lonlat": [
      5.5797,
      50.6326
    ],
    "seed_lonlat": [
      5.5,
      50.5
    ],
    "voronoi_weight": 1.0
  },
  "owner": "fac_liege",
  "culture": "cul_french",
  "religion": "rel_catholic",
  "population": {
    "uncertain": true,
    "note": "Liège compte environ 20 000 habitants.",
    "classes": {
      "peasants": {
        "count": 332060,
        "unrest": 10,
        "health": 55,
        "wealth": 45,
        "goods_satisfaction": 60
      },
      "burghers": {
        "count": 64000,
        "unrest": 10,
        "health": 50,
        "wealth": 60,
        "goods_satisfaction": 65
      },
      "clergy": {
        "count": 10250,
        "unrest": 5,
        "health": 60,
        "wealth": 70,
        "goods_satisfaction": 75
      },
      "nobility": {
        "count": 3690,
        "unrest": 10,
        "health": 60,
        "wealth": 70,
        "goods_satisfaction": 75
      }
    }
  },
  "buildings": [
    "bld_market",
    "bld_water_mill",
    "bld_weaving_workshop",
    "bld_cathedral",
    "bld_stone_walls",
    "bld_muster_field",
    "bld_forge"
  ],
  "fortification_level": 2,
  "base_supply": 3650,
  "description": "Principauté épiscopale de Liège, évêque Adolphe de La Marck, allié de la France. Houillères et forges de la Meuse, Huy, Dinant (dinanderie). Province composée : regroupe aussi Luxembourg.",
  "sources": [
    "Principauté de Liège",
    "Adolphe de La Marck",
    "Liège",
    "Comté de Luxembourg",
    "Jean Ier de Bohême"
  ]
}
