{
  "id": "prov_carniola",
  "name": {
    "display": "Carniole",
    "local": "Kranjska",
    "local_language": "slovène"
  },
  "region": "empire_est",
  "terrain": "mountains",
  "climate": "continental",
  "neighbors": [],
  "rivers": [
    "Save",
    "Ljubljanica"
  ],
  "coastal": false,
  "resources": [
    "res_iron",
    "res_wood",
    "res_wheat"
  ],
  "capital_city": {
    "name": {
      "display": "Ljubljana",
      "local": "Laibach",
      "local_language": "moyen haut-allemand"
    },
    "lat": 46.0569,
    "lon": 14.5058
  },
  "geo": {
    "capital_lonlat": [
      14.5058,
      46.0569
    ],
    "seed_lonlat": [
      14.6,
      46.05
    ],
    "voronoi_weight": 0.9
  },
  "owner": "fac_austria",
  "culture": "cul_slovene",
  "religion": "rel_catholic",
  "population": {
    "uncertain": true,
    "note": "Carniole avec la Marche wende, acquise avec la Carinthie en 1335.",
    "classes": {
      "peasants": {
        "count": 75000,
        "unrest": 10,
        "health": 55,
        "wealth": 45,
        "goods_satisfaction": 60
      },
      "burghers": {
        "count": 3000,
        "unrest": 10,
        "health": 50,
        "wealth": 60,
        "goods_satisfaction": 65
      },
      "clergy": {
        "count": 1650,
        "unrest": 5,
        "health": 60,
        "wealth": 70,
        "goods_satisfaction": 75
      },
      "nobility": {
        "count": 1125,
        "unrest": 10,
        "health": 60,
        "wealth": 70,
        "goods_satisfaction": 75
      }
    }
  },
  "buildings": [
    "bld_market",
    "bld_castle"
  ],
  "fortification_level": 2,
  "base_supply": 1400,
  "description": "Carniole et Marche wende, passées aux Habsbourg avec la Carinthie en 1335 ; Laibach est une petite ville de la Save gardée par son château.",
  "sources": [
    "Carniole",
    "Ljubljana"
  ]
}
