{
  "id": "prov_jutland",
  "name": {
    "display": "Jutland",
    "local": "Jylland",
    "local_language": "vieux danois"
  },
  "region": "scandinavie",
  "terrain": "heath",
  "climate": "oceanic",
  "neighbors": [],
  "rivers": [
    "Gudenå",
    "Limfjord"
  ],
  "coastal": true,
  "ports": [
    "Ribe",
    "Aarhus",
    "Odense",
    "Nyborg",
    "Svendborg",
    "Aalborg",
    "Skagen"
  ],
  "sea_zones": [
    "sea_north_sea",
    "sea_baltic"
  ],
  "resources": [
    "res_fish",
    "res_wool",
    "res_wheat"
  ],
  "capital_city": {
    "name": {
      "display": "Aalborg",
      "local": "Aalborg",
      "local_language": "danois médiéval"
    },
    "lat": 57.0488,
    "lon": 9.9217
  },
  "geo": {
    "capital_lonlat": [
      9.9217,
      57.0488
    ],
    "seed_lonlat": [
      9.3,
      56.2
    ],
    "voronoi_weight": 1.2
  },
  "owner": "fac_holstein",
  "culture": "cul_danish",
  "religion": "rel_catholic",
  "population": {
    "uncertain": true,
    "note": "Ribe compte environ 5 000 habitants.",
    "classes": {
      "peasants": {
        "count": 478520,
        "unrest": 22,
        "health": 55,
        "wealth": 45,
        "goods_satisfaction": 60
      },
      "burghers": {
        "count": 39250,
        "unrest": 23,
        "health": 52,
        "wealth": 60,
        "goods_satisfaction": 65
      },
      "clergy": {
        "count": 13850,
        "unrest": 7,
        "health": 58,
        "wealth": 70,
        "goods_satisfaction": 75
      },
      "nobility": {
        "count": 5220,
        "unrest": 21,
        "health": 58,
        "wealth": 70,
        "goods_satisfaction": 75
      }
    }
  },
  "buildings": [
    "bld_market",
    "bld_windmill",
    "bld_port",
    "bld_cathedral",
    "bld_palisade",
    "bld_muster_field"
  ],
  "fortification_level": 1,
  "base_supply": 8700,
  "description": "Danemark sans roi (interrègne 1332-1340) : le Jutland est engagé au comte Gérard III de Holstein. Révolte paysanne en gestation. Province composée : regroupe aussi Fionie, Jutland du Nord.",
  "sources": [
    "Interrègne danois (1332-1340)",
    "Gérard III de Holstein",
    "Ribe",
    "Fionie",
    "Odense",
    "Gérard III de Holstein-Rendsbourg",
    "Jutland du Nord",
    "Aalborg"
  ]
}
