{
  "id": "prov_sjaelland",
  "name": {
    "display": "Seeland et Scanie",
    "local": "Sjælland",
    "local_language": "vieux danois"
  },
  "region": "scandinavie",
  "terrain": "plains",
  "climate": "oceanic",
  "neighbors": [],
  "rivers": [
    "Gudenå",
    "Limfjord"
  ],
  "coastal": true,
  "ports": [
    "Copenhague",
    "Odense",
    "Nyborg",
    "Svendborg",
    "Ribe",
    "Aarhus",
    "Aalborg",
    "Skagen"
  ],
  "sea_zones": [
    "sea_baltic",
    "sea_north_sea"
  ],
  "resources": [
    "res_fish",
    "res_wheat",
    "res_wool"
  ],
  "capital_city": {
    "name": {
      "display": "Roskilde",
      "local": "Roskilde",
      "local_language": "vieux danois"
    },
    "lat": 55.6415,
    "lon": 12.0803
  },
  "geo": {
    "capital_lonlat": [
      12.0803,
      55.6415
    ],
    "seed_lonlat": [
      12.5,
      55.7
    ],
    "voronoi_weight": 1.3
  },
  "owner": "fac_holstein_kiel",
  "culture": "cul_danish",
  "religion": "rel_catholic",
  "population": {
    "uncertain": true,
    "note": "Lund et Roskilde comptent chacune environ 5 000 habitants.",
    "classes": {
      "peasants": {
        "count": 723800,
        "unrest": 23,
        "health": 55,
        "wealth": 45,
        "goods_satisfaction": 60
      },
      "burghers": {
        "count": 64450,
        "unrest": 24,
        "health": 51,
        "wealth": 60,
        "goods_satisfaction": 65
      },
      "clergy": {
        "count": 20850,
        "unrest": 6,
        "health": 59,
        "wealth": 70,
        "goods_satisfaction": 75
      },
      "nobility": {
        "count": 7740,
        "unrest": 22,
        "health": 58,
        "wealth": 70,
        "goods_satisfaction": 75
      }
    }
  },
  "buildings": [
    "bld_market",
    "bld_windmill",
    "bld_port",
    "bld_cathedral",
    "bld_palisade",
    "bld_muster_field"
  ],
  "fortification_level": 1,
  "base_supply": 3700,
  "description": "Seeland engagé au comte Jean III de Holstein ; la Scanie (Lund, foires au hareng de Skanör) s’est donnée en 1332 à Magnus IV de Suède. Terres royales danoises en déshérence jusqu’à Valdemar IV (1340). Province composée : regroupe aussi Fionie, Jutland, Jutland du Nord.",
  "sources": [
    "Interrègne danois (1332-1340)",
    "Scanie",
    "Roskilde",
    "Fionie",
    "Odense",
    "Gérard III de Holstein-Rendsbourg",
    "Gérard III de Holstein",
    "Ribe",
    "Jutland du Nord",
    "Aalborg"
  ]
}
