{
  "id": "prov_alania",
  "name": {
    "display": "Alanie (Ossétie)",
    "local": "Ир",
    "local_language": "alan (ossète)"
  },
  "region": "caucase",
  "terrain": "mountains",
  "climate": "mountain",
  "neighbors": [],
  "coastal": false,
  "rivers": [
    "Terek"
  ],
  "resources": [
    "res_wool",
    "res_wood",
    "res_iron"
  ],
  "capital_city": {
    "name": {
      "display": "Alagir",
      "local": "Ælægir",
      "local_language": "alan (ossète)"
    },
    "lat": 43.04,
    "lon": 44.2
  },
  "geo": {
    "capital_lonlat": [
      44.2,
      43.04
    ],
    "seed_lonlat": [
      44.4,
      43.2
    ],
    "voronoi_weight": 1.6
  },
  "owner": "fac_alania",
  "culture": "cul_alan",
  "religion": "rel_orthodox",
  "population": {
    "classes": {
      "peasants": {
        "count": 20000,
        "unrest": 10,
        "health": 50,
        "wealth": 45,
        "goods_satisfaction": 60
      },
      "burghers": {
        "count": 2400,
        "unrest": 10,
        "health": 50,
        "wealth": 55,
        "goods_satisfaction": 60
      },
      "clergy": {
        "count": 600,
        "unrest": 5,
        "health": 55,
        "wealth": 60,
        "goods_satisfaction": 70
      },
      "nobility": {
        "count": 240,
        "unrest": 10,
        "health": 60,
        "wealth": 70,
        "goods_satisfaction": 75
      }
    },
    "uncertain": true,
    "note": "Estimation de jeu ; aucun recensement."
  },
  "buildings": [
    "bld_market",
    "bld_castle",
    "bld_muster_field"
  ],
  "fortification_level": 1,
  "base_supply": 600,
  "description": "Restes du royaume des Alains, réfugiés dans les vallées du Grand Caucase après le passage des Mongols ; chrétiens orthodoxes de tradition, soumis à la Horde.",
  "sources": [
    "Alania",
    "Ossetians"
  ]
}
