{
  "id": "prov_polotsk",
  "name": {
    "display": "Polotsk",
    "local": "Polatsk",
    "local_language": "ruthène"
  },
  "region": "lituanie",
  "terrain": "forest",
  "climate": "continental",
  "neighbors": [],
  "rivers": [
    "Dvina",
    "Polota"
  ],
  "coastal": false,
  "resources": [
    "res_wood",
    "res_wheat",
    "res_fish"
  ],
  "capital_city": {
    "name": {
      "display": "Polotsk",
      "local": "Polatsk",
      "local_language": "ruthène"
    },
    "lat": 55.4879,
    "lon": 28.7856
  },
  "geo": {
    "capital_lonlat": [
      28.7856,
      55.4879
    ],
    "seed_lonlat": [
      28.8,
      55.5
    ],
    "voronoi_weight": 1.0
  },
  "owner": "fac_lithuania",
  "culture": "cul_ruthenian",
  "religion": "rel_orthodox",
  "population": {
    "uncertain": true,
    "note": "Ville de la Dvina rattachée à la Lituanie depuis 1307 ; commerce avec Riga.",
    "classes": {
      "peasants": {
        "count": 75000,
        "unrest": 10,
        "health": 55,
        "wealth": 45,
        "goods_satisfaction": 60
      },
      "burghers": {
        "count": 2250,
        "unrest": 10,
        "health": 50,
        "wealth": 60,
        "goods_satisfaction": 65
      },
      "clergy": {
        "count": 1650,
        "unrest": 5,
        "health": 60,
        "wealth": 70,
        "goods_satisfaction": 75
      },
      "nobility": {
        "count": 1875,
        "unrest": 10,
        "health": 60,
        "wealth": 70,
        "goods_satisfaction": 75
      }
    }
  },
  "buildings": [
    "bld_castle",
    "bld_market",
    "bld_muster_field",
    "bld_cathedral"
  ],
  "fortification_level": 3,
  "base_supply": 1400,
  "description": "Principauté de Polotsk sur la Dvina, sous la domination lituanienne depuis 1307 ; cathédrale Sainte-Sophie et commerce fluvial vers Riga.",
  "sources": [
    "Polotsk",
    "Principauté de Polotsk"
  ]
}
