{
  "id": "prov_hungary_central",
  "name": {
    "display": "Hongrie centrale",
    "local": "Magyarország",
    "local_language": "hongrois"
  },
  "region": "hongrie",
  "terrain": "plains",
  "climate": "continental",
  "neighbors": [],
  "rivers": [
    "Danube",
    "Ipoly",
    "Tisza",
    "Maros",
    "Drave",
    "Kapos",
    "Sárvíz",
    "Zala"
  ],
  "coastal": false,
  "resources": [
    "res_wheat",
    "res_wine",
    "res_wood",
    "res_fish",
    "res_wool",
    "res_salt"
  ],
  "capital_city": {
    "name": {
      "display": "Visegrád",
      "local": "Visegrád",
      "local_language": "hongrois"
    },
    "lat": 47.7892,
    "lon": 18.97
  },
  "geo": {
    "capital_lonlat": [
      18.97,
      47.7892
    ],
    "seed_lonlat": [
      19.3,
      47.55
    ],
    "voronoi_weight": 1.5
  },
  "owner": "fac_hungary",
  "culture": "cul_hungarian",
  "religion": "rel_catholic",
  "population": {
    "uncertain": true,
    "note": "Cour de Charles Robert à Visegrád ; Buda et Esztergom, siège de l'archevêque primat.",
    "classes": {
      "peasants": {
        "count": 690000,
        "unrest": 10,
        "health": 55,
        "wealth": 45,
        "goods_satisfaction": 60
      },
      "burghers": {
        "count": 34900,
        "unrest": 10,
        "health": 50,
        "wealth": 60,
        "goods_satisfaction": 65
      },
      "clergy": {
        "count": 15180,
        "unrest": 5,
        "health": 60,
        "wealth": 70,
        "goods_satisfaction": 75
      },
      "nobility": {
        "count": 25900,
        "unrest": 10,
        "health": 60,
        "wealth": 70,
        "goods_satisfaction": 75
      }
    }
  },
  "buildings": [
    "bld_market",
    "bld_castle",
    "bld_cathedral",
    "bld_stone_walls",
    "bld_fair",
    "bld_muster_field"
  ],
  "fortification_level": 3,
  "base_supply": 2550,
  "description": "Cœur du royaume de Charles Ier Robert : le coude du Danube avec Visegrád (cour royale depuis 1323), Buda et Esztergom, archevêché primat de Hongrie. Province composée : regroupe aussi Grande Plaine (Kiskunság), Transdanubie méridionale, Transdanubie centrale.",
  "sources": [
    "Royaume de Hongrie",
    "Charles Ier de Hongrie",
    "Visegrád",
    "Grande Plaine hongroise",
    "Szeged",
    "Kalocsa",
    "Pécs",
    "Comitat de Baranya",
    "Székesfehérvár",
    "Veszprém",
    "Lac Balaton"
  ]
}
