{
  "id": "prov_fyn",
  "name": {
    "display": "Fionie",
    "local": "Fyn",
    "local_language": "danois médiéval"
  },
  "region": "scandinavie",
  "terrain": "plains",
  "climate": "oceanic",
  "neighbors": [],
  "coastal": true,
  "ports": [
    "Odense",
    "Nyborg",
    "Svendborg"
  ],
  "sea_zones": [
    "sea_baltic"
  ],
  "resources": [
    "res_wheat",
    "res_fish",
    "res_wool"
  ],
  "capital_city": {
    "name": {
      "display": "Odense",
      "local": "Odense",
      "local_language": "danois médiéval"
    },
    "lat": 55.3959,
    "lon": 10.3883
  },
  "geo": {
    "capital_lonlat": [
      10.3883,
      55.3959
    ],
    "seed_lonlat": [
      10.35,
      55.3
    ],
    "voronoi_weight": 0.55
  },
  "owner": "fac_holstein",
  "culture": "cul_danish",
  "religion": "rel_catholic",
  "population": {
    "classes": {
      "peasants": {
        "count": 90000,
        "unrest": 10,
        "health": 55,
        "wealth": 45,
        "goods_satisfaction": 60
      },
      "burghers": {
        "count": 6300,
        "unrest": 10,
        "health": 55,
        "wealth": 60,
        "goods_satisfaction": 65
      },
      "clergy": {
        "count": 2700,
        "unrest": 10,
        "health": 55,
        "wealth": 70,
        "goods_satisfaction": 75
      },
      "nobility": {
        "count": 1080,
        "unrest": 10,
        "health": 55,
        "wealth": 70,
        "goods_satisfaction": 75
      }
    },
    "uncertain": true,
    "note": "Estimation démographique approximative (aucun recensement en 1337)."
  },
  "buildings": [
    "bld_market",
    "bld_port",
    "bld_muster_field",
    "bld_cathedral"
  ],
  "fortification_level": 1,
  "base_supply": 2000,
  "description": "Île fertile entre le Petit et le Grand Belt, gagée au comte Gérard III de Holstein avec le Jutland ; Odense, siège épiscopal, garde le tombeau de saint Knud.",
  "sources": [
    "Fionie",
    "Odense",
    "Gérard III de Holstein-Rendsbourg"
  ]
}
