{
  "id": "prov_middlesex",
  "name": {
    "display": "Londres, Middlesex et Essex",
    "local": "Middlesex",
    "local_language": "moyen anglais"
  },
  "region": "angleterre_sud",
  "terrain": "plains",
  "climate": "oceanic",
  "neighbors": [
    "prov_devon",
    "prov_kent",
    "prov_yorkshire"
  ],
  "rivers": [
    "Tamise",
    "Lea",
    "Colne",
    "Ouse",
    "Nene",
    "Witham",
    "Wensum",
    "Arun",
    "Wey",
    "Avon",
    "Test",
    "Itchen",
    "Stour"
  ],
  "coastal": true,
  "ports": [
    "Londres",
    "Colchester",
    "Maldon",
    "Yarmouth",
    "Lynn",
    "Boston",
    "Ipswich",
    "Hastings",
    "Rye",
    "Winchelsea",
    "Shoreham",
    "Southampton",
    "Portsmouth",
    "Poole",
    "Weymouth"
  ],
  "sea_zones": [
    "sea_north_sea",
    "sea_channel"
  ],
  "resources": [
    "res_cloth",
    "res_wheat",
    "res_wool",
    "res_fish",
    "res_iron",
    "res_wood",
    "res_stone"
  ],
  "capital_city": {
    "name": {
      "display": "Londres",
      "local": "London",
      "local_language": "moyen anglais"
    },
    "lat": 51.5074,
    "lon": -0.1276
  },
  "geo": {
    "capital_lonlat": [
      -0.1276,
      51.5074
    ],
    "seed_lonlat": [
      0.1,
      51.65
    ],
    "voronoi_weight": 1.4
  },
  "owner": "fac_england",
  "culture": "cul_english",
  "religion": "rel_catholic",
  "population": {
    "uncertain": true,
    "note": "Londres compte environ 50 000 habitants, la plus grande ville des îles Britanniques.",
    "classes": {
      "peasants": {
        "count": 1147321,
        "unrest": 10,
        "health": 55,
        "wealth": 45,
        "goods_satisfaction": 60
      },
      "burghers": {
        "count": 224400,
        "unrest": 10,
        "health": 48,
        "wealth": 63,
        "goods_satisfaction": 65
      },
      "clergy": {
        "count": 35500,
        "unrest": 5,
        "health": 60,
        "wealth": 70,
        "goods_satisfaction": 75
      },
      "nobility": {
        "count": 12779,
        "unrest": 10,
        "health": 60,
        "wealth": 70,
        "goods_satisfaction": 75
      }
    }
  },
  "buildings": [
    "bld_windmill",
    "bld_port",
    "bld_weaving_workshop",
    "bld_cathedral",
    "bld_fair",
    "bld_castle",
    "bld_archery_butts",
    "bld_counting_house",
    "bld_armoury"
  ],
  "fortification_level": 3,
  "base_supply": 5500,
  "description": "Cité de Londres (capitale de jeu de l’Angleterre), Westminster (Parlement, Échiquier), Tour de Londres ; Middlesex, Essex et Hertfordshire. Étape de la laine, marchands italiens de Lombard Street. Province composée : regroupe aussi Est-Anglie et Lincoln, Sussex et Surrey, Wessex (Hampshire, Wiltshire, Dorset).",
  "sources": [
    "Londres au Moyen Âge",
    "Westminster",
    "Essex",
    "Norfolk",
    "Lincolnshire",
    "Norwich",
    "Sussex",
    "Weald",
    "Cinque Ports",
    "Wessex",
    "Southampton",
    "Winchester"
  ]
}
