{
  "id": "prov_agenais",
  "name": {
    "display": "Agenais et Bazadais",
    "local": "Agenés",
    "local_language": "occitan"
  },
  "region": "aquitaine",
  "terrain": "plains",
  "climate": "oceanic",
  "neighbors": [],
  "rivers": [
    "Garonne",
    "Lot",
    "Baïse",
    "Ariège",
    "Dordogne",
    "Isle",
    "Vézère",
    "Aveyron",
    "Tarn"
  ],
  "coastal": false,
  "resources": [
    "res_wheat",
    "res_wine",
    "res_wood",
    "res_iron",
    "res_wool",
    "res_cloth"
  ],
  "capital_city": {
    "name": {
      "display": "Agen",
      "local": "Agen",
      "local_language": "occitan"
    },
    "lat": 44.2049,
    "lon": 0.6163
  },
  "geo": {
    "capital_lonlat": [
      0.6163,
      44.2049
    ],
    "seed_lonlat": [
      0.5,
      44.35
    ],
    "voronoi_weight": 1.2
  },
  "owner": "fac_france",
  "culture": "cul_occitan",
  "religion": "rel_catholic",
  "population": {
    "uncertain": true,
    "note": "Agen compte environ 8 000 habitants.",
    "classes": {
      "peasants": {
        "count": 978401,
        "unrest": 15,
        "health": 55,
        "wealth": 45,
        "goods_satisfaction": 60
      },
      "burghers": {
        "count": 141800,
        "unrest": 14,
        "health": 50,
        "wealth": 60,
        "goods_satisfaction": 65
      },
      "clergy": {
        "count": 28900,
        "unrest": 5,
        "health": 60,
        "wealth": 70,
        "goods_satisfaction": 75
      },
      "nobility": {
        "count": 10519,
        "unrest": 15,
        "health": 60,
        "wealth": 70,
        "goods_satisfaction": 75
      }
    }
  },
  "buildings": [
    "bld_market",
    "bld_parish_church",
    "bld_windmill",
    "bld_vineyard_press",
    "bld_stone_walls",
    "bld_muster_field"
  ],
  "fortification_level": 2,
  "base_supply": 4500,
  "description": "Agenais occupé par la France depuis la guerre de Saint-Sardos (1324) et non restitué en 1327 ; l’Angleterre en réclame la restitution. Bastides, Garonne navigable. Province composée : regroupe aussi Foix, Périgord, Quercy, Toulousain.",
  "sources": [
    "Agenais",
    "Guerre de Saint-Sardos",
    "Agen",
    "Comté de Foix",
    "Gaston II de Foix-Béarn",
    "Comté de Périgord",
    "Périgueux",
    "Quercy",
    "Cahors",
    "Comté de Toulouse",
    "Toulouse",
    "Languedoc"
  ]
}
